<?xml version="1.0"?>

<!-- Include the domain DTD definition. -->
<!DOCTYPE domain SYSTEM "domain.dtd" [
        <!ENTITY BIN_DIR "/opt/rt/bin/">
        <!ENTITY DEFAULT_DIR "/home/control">
        <!ENTITY EMULATE "true">
        <!ENTITY ANT "1">
        <!ENTITY TRACE "traceLevel=0 traceFile=syslog">
        <!ENTITY DBMS "useDBMS=false">
        <!ENTITY LOG "">
]>

<!-- Configuration for standalone testing of an ovro antenna on a single
     machine.  This is most useful for the OvroLab machines (ovrolab and 
     canlab3) since it allows them to run all needed applications without
     a foreign IMR (and hence much decreased robustness).
     
     Note: the use of "localhost" is fine is this file for a single machine
     but very hazardous in a multi-machine configuration.
 -->

<!-- @version -->
<domain>
 
    
    <oad hostname="localhost">

        <!-- Control -->
        <server name="DelayEngineFSP" 
                path="&BIN_DIR;/frameScriberPublisher"
                directory="&BIN_DIR;" 
                args="&LOG; &DBMS; subsystem=delayEngine"
                system="interferometry"
                critical="true"/>

        <server name="Subarray1" 
                path="&BIN_DIR;subarrayControl"
                directory="&BIN_DIR;" 
                args="runSAT=true &LOG; &DBMS;"
                system="control"
                critical="true" />

        <server name="ControlFSP" 
                path="&BIN_DIR;/frameScriberPublisher"
                directory="&BIN_DIR;" 
                args="&LOG; &DBMS; subsystem=control"
                critical="false" />
        
        <!-- Monitor -->
        <server name="FrameCollator" 
                path="&BIN_DIR;/frameCollator"
                directory="&DEFAULT_DIR;" 
                args=" &DBMS; mode=final"/>

        <!-- Process Monitor -->
        <server name="ProcessMonitorFSP"
                path="&BIN_DIR;frameScriberPublisher"
                directory="&BIN_DIR;" 
                args="&LOG; &DBMS; subsystem=Imr delay=150" />

        <server name="ProcessMonitor"
                path="&BIN_DIR;/processMonitor"
                directory="&BIN_DIR;"
                args="&LOG; &DBMS; file=/opt/rt/conf/imr/ovroLocal.xml  writedelay=0.100" />

        <!-- Ovro Antenna -->
        <server name="FSPOvro&ANT;" path="&BIN_DIR;/frameScriberPublisher"
                directory="&DEFAULT_DIR;" 
                args="subsystem=Ovro&ANT; &DBMS;" />
 
         <server name="RemoteCan&ANT;" path="&BIN_DIR;/canOverIpServer"
                directory="&DEFAULT_DIR;"   
                args=" &DBMS;"/>

        <server name="Ovro&ANT;CanHost"
                path="&BIN_DIR;/ovroCanHost"
                directory="&DEFAULT_DIR;" 
                args="ant=&ANT; &TRACE; simulate=true terminate=true  &DBMS;"/>
    </oad>


    
    
</domain>
    
